兵庫県篠山市,兵庫県丹波篠山市
福岡県筑紫郡那珂川町,福岡県那珂川市
宮城県黒川郡富谷町,宮城県富谷市
栃木県下都賀郡岩舟町,栃木県栃木市
岩手県岩手郡滝沢村,岩手県滝沢市
千葉県山武郡大網白里町,千葉県大網白里市
埼玉県南埼玉郡白岡町,埼玉県白岡市
愛知県愛知郡長久手町,愛知県長久手市
石川県石川郡野々市町,石川県野々市市
埼玉県鳩ケ谷市,埼玉県川口市
島根県簸川郡斐川町,島根県出雲市
栃木県上都賀郡西方町,栃木県栃木市
岩手県東磐井郡藤沢町,岩手県一関市
島根県八束郡東出雲町,島根県松江市
愛知県幡豆郡一色町,愛知県西尾市
愛知県幡豆郡吉良町,愛知県西尾市
愛知県幡豆郡幡豆町,愛知県西尾市
新潟県北魚沼郡川口町,新潟県長岡市
長野県東筑摩郡波田町,長野県松本市
長崎県北松浦郡江迎町,長崎県佐世保市
長崎県北松浦郡鹿町町,長崎県佐世保市
栃木県下都賀郡大平町,栃木県栃木市
栃木県下都賀郡藤岡町,栃木県栃木市
栃木県下都賀郡都賀町,栃木県栃木市
群馬県吾妻郡中之条町,群馬県吾妻郡中之条町
群馬県吾妻郡六合村,群馬県吾妻郡中之条町
千葉県印旛郡印旛村,千葉県印西市
千葉県印旛郡本埜村,千葉県印西市
埼玉県北埼玉郡騎西町,埼玉県加須市
埼玉県北埼玉郡北川辺町,埼玉県加須市
埼玉県北埼玉郡大利根町,埼玉県加須市
埼玉県南埼玉郡菖蒲町,埼玉県久喜市
埼玉県北葛飾郡栗橋町,埼玉県久喜市
埼玉県北葛飾郡鷲宮町,埼玉県久喜市
静岡県富士郡芝川町,静岡県富士宮市
静岡県浜名郡新居町,静岡県湖西市
熊本県下益城郡城南町,熊本県熊本市
熊本県鹿本郡植木町,熊本県熊本市
宮崎県宮崎郡清武町,宮崎県宮崎市
宮崎県西諸県郡野尻町,宮崎県小林市
鹿児島県姶良郡加治木町,鹿児島県姶良市
鹿児島県姶良郡姶良町,鹿児島県姶良市
鹿児島県姶良郡蒲生町,鹿児島県姶良市
愛知県海部郡七宝町,愛知県あま市
愛知県海部郡美和町,愛知県あま市
愛知県海部郡甚目寺町,愛知県あま市
滋賀県近江八幡市,滋賀県近江八幡市
滋賀県蒲生郡安土町,滋賀県近江八幡市
山梨県南巨摩郡増穂,山梨県南巨摩郡富士川町
山梨県南巨摩郡鰍沢町,山梨県南巨摩郡富士川町
福岡県八女郡黒木町,福岡県八女市
福岡県八女郡立花町,福岡県八女市
福岡県八女郡矢部村,福岡県八女市
福岡県八女郡星野村,福岡県八女市
愛知県宝飯郡小坂井町,愛知県豊川市
山口県阿武郡阿東町,山口県山口市
愛知県西加茂郡三好町,愛知県みよし市
岩手県下閉伊郡川井村,岩手県宮古市
長野県上水内郡信州新町,長野県長野市
長野県上水内郡中条村,長野県長野市
滋賀県東浅井郡虎姫町,滋賀県長浜市
滋賀県東浅井郡湖北町,滋賀県長浜市
滋賀県伊香郡高月町,滋賀県長浜市
滋賀県伊香郡木之本町,滋賀県長浜市
滋賀県伊香郡余呉町,滋賀県長浜市
滋賀県伊香郡西浅井町,滋賀県長浜市
福岡県糸島郡二丈町,福岡県糸島市
福岡県糸島郡志摩町,福岡県糸島市